<?xml version="1.0" encoding="UTF-8"?>
<!DOCTYPE Curriculum_Vitae SYSTEM "cv_dtd.dtd">
<Curriculum_Vitae>
    <datuPertsonalak>
        <izena></izena>
        <abizena></abizena>
        <korreoa></korreoa>
        <telefonoa></telefonoa>
    </datuPertsonalak>
    
    <formakuntza>
        <ikasketak>
            <titulua></titulua>
            <zentroa></zentroa>
            <urtea></urtea>
        </ikasketak>
    </formakuntza>
    
    <Lan-experientzia>
        <lana>
            <postua></postua>
            <enpresa></enpresa>
            <lan-iraupena></lan-iraupena>
        </lana>
    </Lan-experientzia>
    
    <gaitasunak>
        <gaitasuna></gaitasuna>
        <gaitasuna></gaitasuna>
        <gaitasuna></gaitasuna>
    </gaitasunak>
</Curriculum_Vitae>